{"otp_id":"OTP-V7-041-AUTOMATION-ADMISSION-ADAPTER-R1","otp_sha256":"0d4aa0f3a81e84b8e799b8cefae3d9eb36c57612b7a27250390bdef9f7f2592b","git_commit":"24fdc1fac85e1412b77ed47e176a9ef994140a10","status":"pass","changed_paths":["automation/scripts/verify_offline_automation_adapter.mjs","docs/contracts/V7-041_OFFLINE_ADMISSION_ADAPTER_BOUNDARY.md","package.json","src/adapters/offline-automation-admission.js"],"checks":["Backup manifest: E:/dashboard-backups/dashboard-v7-041-20261016T070507Z/BACKUP_MANIFEST.md","Frozen V7 SHA256 matches: PASS","Deterministic permitted lifecycle transitions: PASS","Malformed, replay and invalid transition fixtures: PASS","No scheduler, external mutator, credential, database, network or deployment behavior: PASS","TypeScript typecheck: PASS","Next.js production build: PASS","GitHub PR control-plane validation: PASS"],"holds":["HOLD_AUTOMATION_RUNTIME: this is not a scheduler or autonomous external mutator.","HOLD_LIVE_INTEGRATION: no ObserverOS interface authority is granted."]}
