{"otp_id":"OTP-V7-034-ACCOUNTING-CONTRACT-R1","otp_sha256":"eaec1d5cba8b4f73d5ecd16cabb3cbae15414c76e31a94420bb4fc2d7d4ee343","git_commit":"3f98aec369082d54d1afd4416de91f23f2e4c8cd","status":"pass","changed_paths":["automation/scripts/verify_accounting_contract.mjs","docs/contracts/PROPOSED_ACCOUNTING_VIEW_CONTRACT_V1.md","package.json","schemas/proposed-accounting-view-v1.schema.json","src/adapters/proposed-accounting-view-contract.js"],"checks":["Backup manifest: E:/dashboard-backups/dashboard-v7-034-20261016T065935Z/BACKUP_MANIFEST.md","Frozen V7 SHA256 matches: PASS","Opaque read-only accounting boundary: PASS","Null-state and forbidden-field verification: PASS","No calculation, write flow, or network primitive: PASS","TypeScript typecheck: PASS","Next.js production build: PASS","GitHub PR control-plane validation: PASS"],"holds":["HOLD_LIVE_INTEGRATION: no audited ObserverOS browser-safe accounting interface is available.","HOLD_FINANCIAL_DISCLOSURE: no approved financial field classification is available."]}
