{"otp_id":"OTP-V7-050-FULL-REGRESSION-R1","otp_sha256":"489f0e7c60ae8535eb8470b79e6dfcd3d5c13c0b7766dab5a540695485c74cab","git_commit":"b69360db166f23fd3126bd98395a1b6715404961","status":"pass","changed_paths":["automation/scripts/run_full_preos_regression.mjs","docs/contracts/V7-050_FULL_REGRESSION_BOUNDARY.md","package.json"],"checks":["Backup manifest: E:/dashboard-backups/dashboard-v7-050-20261016T070711Z/BACKUP_MANIFEST.md","Frozen V7 SHA256 matches: PASS","26 completed Mock-only boundary/type/build/control-plane checks: PASS","No live-hold promotion: PASS","GitHub PR control-plane validation: PASS"],"holds":["HOLD_LIVE_INTEGRATION: regression is non-live and does not authorize any ObserverOS binding.","HOLD_DATA_AUTHORITY: ObserverOS remains the exclusive future fact, calculation, permission and audit authority."]}
