{
  "otp_id": "OTP-V7-010-DAILY-CONTRACT-R1",
  "otp_sha256": "f1882844516f235b8ca9c65437178ea2357d55e0d4a6f36fb4e5e23fecc808ee",
  "git_commit": "8a563084c9b6a211833f920388f9ab58d01f0461",
  "status": "pass",
  "changed_paths": [
    "automation/scripts/verify_daily_contract.mjs",
    "docs/contracts/PROPOSED_DAILY_READ_CONTRACT_V1.md",
    "package.json",
    "schemas/proposed-daily-read-v1.schema.json",
    "src/adapters/proposed-daily-contract.d.ts",
    "src/adapters/proposed-daily-contract.js"
  ],
  "checks": [
    "Backup manifest: E:/dashboard-backups/dashboard-daily-phase-20261016T060456Z-retry1/BACKUP_MANIFEST.md",
    "Frozen V7 SHA256 matches: PASS",
    "Anonymous aggregate allowlist and exclusion boundary: PASS",
    "Daily contract negative-fixture verification: PASS",
    "Adapter source has no network primitive: PASS",
    "TypeScript typecheck: PASS",
    "Next.js production build: PASS",
    "GitHub PR control-plane validation: PASS"
  ],
  "holds": [
    "HOLD_LIVE_INTEGRATION: ObserverOS has not supplied an audited browser-safe implementation of this proposed contract."
  ]
}
