{"otp_id":"OTP-V7-014-OBSERVATION-PAGE-R1","otp_sha256":"4910d8d0c4891c0e38efabf18dbd4136bdc7d9c512435ca7fc1a4a336453d51b","git_commit":"b1c55cb187a4724caf7295be0a5c63d0629a6a76","status":"pass","changed_paths":["app/globals.css","app/page.tsx","automation/scripts/verify_daily_observation_shell.mjs","docs/contracts/V7-014_DAILY_OBSERVATION_BOUNDARY.md","package.json","src/ui/daily-observation.tsx"],"checks":["Backup manifest: E:/dashboard-backups/dashboard-v7-014-20261016T063450Z/BACKUP_MANIFEST.md","Frozen V7 SHA256 matches: PASS","Six empty observation locations: PASS","No media or local patrol behavior: PASS","Observation shell verification: PASS","TypeScript typecheck: PASS","Next.js production build: PASS","GitHub PR control-plane validation: PASS"],"holds":["HOLD_LIVE_INTEGRATION: no audited ObserverOS browser-safe observation interface is available.","HOLD_MEDIA_AUTHORIZATION: no approved media authorization behavior is available."]}
