{"otp_id":"OTP-V7-030-INSIGHT-ANALYSIS-CONTRACT-R1","otp_sha256":"f3c9542458fb6ba3f3bc7792160604aaa6e3c38f99e442c057947253c273664e","git_commit":"eec73ec9593e57acae6bad042fb301562829d59e","status":"pass","changed_paths":["automation/scripts/verify_insight_analysis_contract.mjs","docs/contracts/PROPOSED_INSIGHT_RESULTS_CONTRACT_V1.md","package.json","schemas/proposed-insight-results-v1.schema.json","src/adapters/proposed-insight-results-contract.js"],"checks":["Backup manifest: E:/dashboard-backups/dashboard-v7-030-20261016T065235Z/BACKUP_MANIFEST.md","Frozen V7 SHA256 matches: PASS","Opaque result and provenance boundary: PASS","Null-state and negative fixture verification: PASS","No local analysis or network primitive: PASS","TypeScript typecheck: PASS","Next.js production build: PASS","GitHub PR control-plane validation: PASS"],"holds":["HOLD_LIVE_INTEGRATION: no audited ObserverOS browser-safe insight interface is available.","HOLD_ANALYSIS_AUTHORITY: Dashboard may not create analysis or recommendations."]}
