{"otp_id":"OTP-V7-031-INSIGHT-ANALYSIS-PAGE-R1","otp_sha256":"eea1b0cc34aaf7dfdbccfc6709b56776c98bd2fd6c467c9bf483c13b8680a02f","git_commit":"2556cbe29fa79c5db528627e4bf33c747a618679","status":"pass","changed_paths":["app/globals.css","app/page.tsx","automation/scripts/verify_insight_analysis_shell.mjs","docs/contracts/V7-031_INSIGHT_ANALYSIS_BOUNDARY.md","package.json","src/ui/insight-analysis.tsx"],"checks":["Backup manifest: E:/dashboard-backups/dashboard-v7-031-20261016T065427Z/BACKUP_MANIFEST.md","Frozen V7 SHA256 matches: PASS","Three fixed EMPTY insight panels: PASS","INSIGHT shell boundary verification: PASS","No generated analysis, network primitive, score, or fixture: PASS","TypeScript typecheck: PASS","Next.js production build: PASS","GitHub PR control-plane validation: PASS"],"holds":["HOLD_LIVE_INTEGRATION: no audited ObserverOS browser-safe insight interface is available.","HOLD_ANALYSIS_AUTHORITY: Dashboard may not create analysis or recommendations."]}
