{"otp_id":"OTP-V7-015-WEBSITE-WORKFLOW-CONTRACT-R1","otp_sha256":"53a62299201820aed355900a1d200603ca1f5b63e9209d2ebb03b13107999087","git_commit":"de9bfdcca567afd8c980c64fb06815d79e07961b","status":"pass","changed_paths":["automation/scripts/verify_website_workflow_contract.mjs","docs/contracts/PROPOSED_WEBSITE_WORKFLOW_CONTRACT_V1.md","package.json","schemas/proposed-website-workflow-v1.schema.json","src/adapters/proposed-website-workflow-contract.js"],"checks":["Backup manifest: E:/dashboard-backups/dashboard-v7-015-20261016T063652Z/BACKUP_MANIFEST.md","Frozen V7 SHA256 matches: PASS","ObserverOS-only confirmation authority: PASS","BOOKING lifecycle reuse rejected: PASS","Website workflow negative fixture verification: PASS","No network primitive: PASS","TypeScript typecheck: PASS","Next.js production build: PASS","GitHub PR control-plane validation: PASS"],"holds":["HOLD_LIVE_INTEGRATION: no audited ObserverOS browser-safe website workflow interface is available.","HOLD_BOOKING_SEMANTICS: no approved website request write-back event and confirmation response is available."]}
