{"otp_id":"OTP-V7-024-WEEKLY-FINANCE-PAGE-R1","otp_sha256":"e7fd4c50d1b3aff69653738fa946241f62c382459a71363e8775e9d17c217ae4","git_commit":"4ddcab17ae4b5aef9cd7c0f113319ad0547d0354","status":"pass","changed_paths":["app/globals.css","app/page.tsx","automation/scripts/verify_weekly_finance_shell.mjs","docs/contracts/V7-024_WEEKLY_FINANCE_BOUNDARY.md","package.json","src/ui/weekly-finance.tsx"],"checks":["Backup manifest: E:/dashboard-backups/dashboard-v7-024-20261016T065042Z/BACKUP_MANIFEST.md","Frozen V7 SHA256 matches: PASS","Three fixed EMPTY finance panels: PASS","Weekly finance shell boundary verification: PASS","No network primitive, finance field, chart data, calculation, or fixture: PASS","TypeScript typecheck: PASS","Next.js production build: PASS","GitHub PR control-plane validation: PASS"],"holds":["HOLD_LIVE_INTEGRATION: no audited ObserverOS browser-safe weekly finance interface is available.","HOLD_DATA_CLASSIFICATION: no approved financial disclosure policy is available."]}
