{"otp_id":"OTP-V7-033-HEALTH-GOVERNANCE-PAGE-R1","otp_sha256":"b70235c15b3b807d5d67dceb60f2e815a9e7e9a895c82db1dd967d9d16e481cf","git_commit":"29e9a2e7f40d4bd768f7218456f23a0e86baecfe","status":"pass","changed_paths":["app/globals.css","app/page.tsx","automation/scripts/verify_health_governance_shell.mjs","docs/contracts/V7-033_HEALTH_GOVERNANCE_BOUNDARY.md","package.json","src/ui/health-governance.tsx"],"checks":["Backup manifest: E:/dashboard-backups/dashboard-v7-033-20261016T065757Z/BACKUP_MANIFEST.md","Frozen V7 SHA256 matches: PASS","Fixed EMPTY Health and Governance panels: PASS","Health governance shell boundary verification: PASS","No health inference, access/audit detail, network primitive, or fixture: PASS","TypeScript typecheck: PASS","Next.js production build: PASS","GitHub PR control-plane validation: PASS"],"holds":["HOLD_LIVE_INTEGRATION: no audited ObserverOS browser-safe health/governance interface is available.","HOLD_GOVERNANCE_CLASSIFICATION: no approved disclosure policy is available."]}
