{
  "otp_id": "OTP-V7-004-INTERFACE-CORE-R1",
  "otp_sha256": "a40bf032415617fb16444654e26d99895c037d8725d356c44fd24b07c67f7953",
  "git_commit": "c643b82ba4d65891fba4a7f425cea2ae91c4f40e",
  "status": "pass",
  "changed_paths": [
    "app/globals.css",
    "app/page.tsx",
    "docs/contracts/V7-004_COMPONENT_REUSE_MAP.md",
    "src/ui/interface-core.tsx"
  ],
  "checks": [
    "V7 shell breakpoints match baseline evidence: PASS",
    "Five presentation states remain separate: PASS",
    "Mock-only boundary retained: PASS",
    "TypeScript typecheck: PASS",
    "Next.js production build: PASS",
    "GitHub PR control-plane validation: PASS"
  ],
  "holds": []
}
