{"otp_id":"OTP-V7-016-WEBSITE-MODULES-R1","otp_sha256":"332991c7a9f5ab316f74c10ddae53643db003a1121e4659046b1baa78cbddfc6","git_commit":"f38cf4dcf4292f28308d5d6cfef2339712157253","status":"pass","changed_paths":["app/globals.css","app/page.tsx","automation/scripts/verify_daily_website_shell.mjs","docs/contracts/V7-016_DAILY_WEBSITE_BOUNDARY.md","package.json","src/ui/daily-website.tsx"],"checks":["Backup manifest: E:/dashboard-backups/dashboard-v7-016-20261016T063933Z/BACKUP_MANIFEST.md","Frozen V7 SHA256 matches: PASS","Three empty website workflow locations: PASS","No form, provider, write, or traffic behavior: PASS","Website shell verification: PASS","TypeScript typecheck: PASS","Next.js production build: PASS","GitHub PR control-plane validation: PASS"],"holds":["HOLD_LIVE_INTEGRATION: no audited ObserverOS browser-safe website workflow interface is available.","HOLD_BOOKING_SEMANTICS: no approved website request write-back and confirmation response is available."]}
