{
  "otp_id": "OTP-V7-021-WEEKLY-OPERATIONS-CONTRACT-R1",
  "otp_sha256": "e2487efc6a9e31d9c0db239899082d18001e6a72e6508cdc55c73b23a068246a",
  "git_commit": "81763b60df5ad71e1c143c1fe96801dfad0c9a76",
  "status": "pass",
  "changed_paths": [
    "automation/scripts/verify_weekly_operations_contract.mjs",
    "docs/contracts/PROPOSED_WEEKLY_OPERATIONS_CONTRACT_V1.md",
    "package.json",
    "schemas/proposed-weekly-operations-v1.schema.json",
    "src/adapters/proposed-weekly-operations-contract.js"
  ],
  "checks": [
    "Backup manifest: E:/dashboard-backups/dashboard-v7-021-20261016T064355Z/BACKUP_MANIFEST.md",
    "Frozen V7 SHA256 matches: PASS",
    "Opaque precomputed operations boundary: PASS",
    "Weekly operations negative fixture verification: PASS",
    "No network primitive: PASS",
    "TypeScript typecheck: PASS",
    "Next.js production build: PASS",
    "GitHub PR control-plane validation: PASS"
  ],
  "holds": [
    "HOLD_LIVE_INTEGRATION: no audited ObserverOS browser-safe weekly operations interface is available.",
    "HOLD_DATA_CLASSIFICATION: no approved people, security, inventory, or finance disclosure policy is available."
  ]
}
