{"otp_id":"OTP-V7-023-WEEKLY-FINANCE-CONTRACT-R1","otp_sha256":"df4deecccc4772dda5b6396ca1e0aab951b8ceed4775366870c9bbb25dba5378","git_commit":"7899235af0771d71c0f695320ca67b047cf7d344","status":"pass","changed_paths":["automation/scripts/verify_weekly_finance_contract.mjs","docs/contracts/PROPOSED_WEEKLY_FINANCE_CONTRACT_V1.md","package.json","schemas/proposed-weekly-finance-v1.schema.json","src/adapters/proposed-weekly-finance-contract.js"],"checks":["Backup manifest: E:/dashboard-backups/dashboard-v7-023-20261016T064845Z/BACKUP_MANIFEST.md","Frozen V7 SHA256 matches: PASS","Null-state finance envelope and exclusion tests: PASS","No network primitive or financial calculation: PASS","TypeScript typecheck: PASS","Next.js production build: PASS","GitHub PR control-plane validation: PASS"],"holds":["HOLD_LIVE_INTEGRATION: no audited ObserverOS browser-safe weekly finance interface is available.","HOLD_DATA_CLASSIFICATION: no approved financial disclosure policy is available."]}
