{"otp_id":"OTP-V7-020-WEEKLY-CALENDAR-R1","otp_sha256":"a11a00b0d48e0f8e3fa3b174b8e3ced3b415f4b36f0f6210c7ea1866a6e4d395","git_commit":"bf8c25c8197bc2a8bbc48f81dcc750857f832a53","status":"pass","changed_paths":["app/globals.css","app/page.tsx","automation/scripts/verify_weekly_calendar_shell.mjs","docs/contracts/V7-020_WEEKLY_CALENDAR_BOUNDARY.md","package.json","src/ui/weekly-calendar.tsx"],"checks":["Backup manifest: E:/dashboard-backups/dashboard-v7-020-20261016T064130Z/BACKUP_MANIFEST.md","Frozen V7 SHA256 matches: PASS","Seven-cell empty WEEKLY calendar frame: PASS","No event, date, query, or persistence behavior: PASS","Calendar shell verification: PASS","TypeScript typecheck: PASS","Next.js production build: PASS","GitHub PR control-plane validation: PASS"],"holds":["HOLD_LIVE_INTEGRATION: no audited ObserverOS browser-safe weekly-calendar interface is available."]}
