{
  "otp_id": "OTP-V7-012A-DAILY-HTML-PREVIEW-R1",
  "otp_sha256": "0baad92cfdf84d01a4ac37467cd3fdf66a11073738d48c9968c4f45a6173fd28",
  "git_commit": "1fcf04cce2addd4b5347c39dc959b5caf4737c32",
  "status": "pass",
  "changed_paths": [
    "automation/scripts/verify_daily_html_preview.mjs",
    "docs/contracts/V7-012A_DAILY_HTML_PREVIEW_BOUNDARY.md",
    "package.json",
    "public/current-progress.html"
  ],
  "checks": [
    "Backup manifest: E:/dashboard-backups/dashboard-v7-012a-20261016T061930Z/BACKUP_MANIFEST.md",
    "Frozen V7 SHA256 matches: PASS",
    "Offline HTML preview contains completed DAILY shell: PASS",
    "Preview contains no script, external asset, API, database, or business fixture: PASS",
    "HTML preview verification: PASS",
    "TypeScript typecheck: PASS",
    "Next.js production build: PASS",
    "GitHub PR control-plane validation: PASS"
  ],
  "holds": [
    "HOLD_LIVE_INTEGRATION: no audited ObserverOS browser-safe DAILY read implementation is available.",
    "HOLD_VISUAL_ACCEPTANCE: the preview is an interim Mock-only display and not formal frozen-V7 screenshot acceptance."
  ]
}
