{"otp_id":"OTP-V7-051-PREOS-SHOWCASE-R1","otp_sha256":"fdfe51f5f28b156485f2c43bbad473368e0b7d00bf4aa6ef7e580d1d1ecca3ba","git_commit":"6802ce3bd21eb1d03ad74debce536f0b6dcf3364","status":"pass","changed_paths":["automation/scripts/verify_preos_showcase.mjs","package.json","public/preobserveros-showcase.html"],"checks":["Backup manifest: E:/dashboard-backups/dashboard-v7-051-20261016T071106Z/BACKUP_MANIFEST.md","Frozen V7 SHA256 matches: PASS","Offline showcase boundary verification: PASS","Full 26-check Pre-ObserverOS regression: PASS","GitHub PR control-plane validation: PASS"],"holds":["HOLD_LIVE_INTEGRATION: showcase does not authorize ObserverOS binding.","HOLD_DATA_AUTHORITY: ObserverOS remains the exclusive future database, fact, calculation, permission, audit and authoritative-status owner."]}
