{"otp_id":"OTP-V7-035-ACCOUNTING-PAGE-R1","otp_sha256":"ac2ccbd183f70d5656c426fc3e2f25075a29a82aaef56fe41704b1ef6141fe42","git_commit":"1e0e369da7eb57e0141f3792f9a29c6fb7b20581","status":"pass","changed_paths":["app/globals.css","app/page.tsx","automation/scripts/verify_accounting_shell.mjs","docs/contracts/V7-035_ACCOUNTING_BOUNDARY.md","package.json","src/ui/accounting-view.tsx"],"checks":["Backup manifest: E:/dashboard-backups/dashboard-v7-035-20261016T070128Z/BACKUP_MANIFEST.md","Frozen V7 SHA256 matches: PASS","Fixed EMPTY Accounting and Invoice workflow panels: PASS","Accounting shell boundary verification: PASS","No finance/file/write behavior, network primitive, or fixture: PASS","TypeScript typecheck: PASS","Next.js production build: PASS","GitHub PR control-plane validation: PASS"],"holds":["HOLD_LIVE_INTEGRATION: no audited ObserverOS browser-safe accounting interface is available.","HOLD_FINANCIAL_DISCLOSURE: no approved financial field classification is available."]}
